{"schemaVersion":"1.0","runId":"run-1355dc83cdda4a01ac28396280d6e02d","sequence":2,"eventType":"state.transitioned","occurredAt":"2026-09-01T15:48:27.3710610\u002B00:00","payload":{"from":"queued","to":"preparing","reason":"Prepare isolated workspace"},"previousHash":"f8f5f26a8b49e29cb328a4fa5ad0da08e1dedafa4dedd1f52cde92bc73481d66","eventHash":"2caf722eaf377f06298b2e15f2b63cfe07b12dffb591ebe4c0c06afab4b84d22"}